{
  "schema_version": "repo-pedant.execution.v1",
  "mode": "evolve",
  "scope": "repo-pedant",
  "result": "passed",
  "checks": [
    {"id": "inventory", "status": "passed", "evidence": "inventory validator returned 0"},
    {"id": "readback", "status": "passed", "evidence": "changed files reread against current code"},
    {"id": "tests", "status": "passed", "evidence": "targeted and full unit suites returned 0"},
    {"id": "links", "status": "passed", "evidence": "public link resolver returned 0"},
    {"id": "diff", "status": "passed", "evidence": "final diff and whitespace checks returned 0"},
    {"id": "coverage", "status": "passed", "evidence": "graph coverage reported no recorded gap for changed code paths"}
  ],
  "events": [
    {"stage": "start", "message": "🦊 阿舟 · Repo Pedant 启动｜mode=evolve｜scope=repo-pedant"},
    {"stage": "scope", "message": "🧭 范围锁定｜authority=SKILL.md｜projects=1"},
    {"stage": "inventory", "message": "🗂️ 清单完成｜files=64｜holds=0｜out_of_scope=2"},
    {"stage": "impact", "message": "🕸️ 影响确认｜surfaces=8｜consumers=4"},
    {"stage": "sync", "message": "🧹 同步完成｜changed=9"},
    {
      "stage": "verify_success",
      "message": "✅ 验证通过｜checks=inventory,readback,tests,links,diff,coverage",
      "completed_checks": ["inventory", "readback", "tests", "links", "diff", "coverage"]
    }
  ]
}
