{
  "schema_version": "repo-pedant.execution.v1",
  "mode": "evolve",
  "scope": "repo-pedant",
  "result": "passed",
  "checks": [
    {"id": "inventory", "status": "passed", "evidence": "inventory validator returned 0"},
    {"id": "readback", "status": "passed", "evidence": "changed files reread"},
    {"id": "tests", "status": "passed", "evidence": "unit suite returned 0"},
    {"id": "links", "status": "passed", "evidence": "link test returned 0"},
    {"id": "diff", "status": "passed", "evidence": "diff checked"},
    {"id": "coverage", "status": "passed", "evidence": "coverage checked"}
  ],
  "events": [
    {"stage": "start", "message": "🦊 阿舟 · Repo Pedant 启动：mode=evolve，scope=repo-pedant"},
    {"stage": "scope", "message": "🧭 范围锁定：authority=SKILL.md，projects=1"},
    {"stage": "inventory", "message": "🗂️ 清单阶段：64 files，holds=0，out_of_scope=2"},
    {"stage": "impact", "message": "🕸️ 影响确认：surfaces=8，consumers=4"},
    {"stage": "sync", "message": "🧹 同步完成：changed=9"},
    {
      "stage": "verify_success",
      "message": "✅ 核心验证通过：inventory、tests、links、diff、coverage",
      "completed_checks": ["inventory", "readback", "tests", "links", "diff", "coverage"]
    }
  ]
}
